{
  "$schema": "https://json-schema.org/draft/2020-12/schema",
  "$id": "https://github.com/smyrdev/samy-workout-skills/skills/onboarding/assets/schema/program.schema.json",
  "title": "Program answers",
  "description": "profile/programs/program-YYYY-MM-DD.json — one per training block, written by the onboarding skill. volume is filled by scripts/volume.py and is optional: absent or null is a valid, unscaled file.",
  "type": "object",
  "required": ["$schema_version", "created_at", "program"],
  "additionalProperties": false,
  "properties": {
    "$schema_version": { "const": "1.0" },
    "created_at": {
      "type": "string",
      "pattern": "^\\d{4}-\\d{2}-\\d{2}T\\d{2}:\\d{2}:\\d{2}Z$"
    },
    "program": {
      "type": "object",
      "required": [
        "name",
        "emoji",
        "primary_goal",
        "days_per_week",
        "session_minutes",
        "split",
        "deload"
      ],
      "additionalProperties": false,
      "properties": {
        "name": { "type": "string", "minLength": 1, "maxLength": 60 },
        "emoji": { "type": "string", "minLength": 1 },
        "primary_goal": { "enum": ["hypertrophy", "strength", "both"] },
        "days_per_week": { "type": "integer", "minimum": 3, "maximum": 7 },
        "session_minutes": {
          "enum": ["up_to_20", "20-40", "40-60", "60-90", "90-120", "over_120"]
        },
        "split": { "enum": ["full_body", "upper_lower"] },
        "deload": { "type": "boolean" }
      }
    },
    "volume": {
      "description": "Computed by skills/onboarding/scripts/volume.py. Absent or null until that script runs — a program file without it is still schema-valid.",
      "oneOf": [
        { "type": "null" },
        {
          "type": "object",
          "required": [
            "model_version",
            "age",
            "bodyfat_midpoint",
            "equipment_tier",
            "benchmarks_cleared",
            "exercises_per_session",
            "sets_per_exercise",
            "weekly_set_capacity",
            "weekly_sets_allocated",
            "unallocated_sets",
            "target_weekly_sets_per_muscle",
            "scale_factor",
            "per_muscle_weekly_sets",
            "warnings"
          ],
          "additionalProperties": false,
          "properties": {
            "model_version": { "const": "1.0" },
            "age": { "type": "integer", "minimum": 0 },
            "bodyfat_midpoint": { "type": "number" },
            "equipment_tier": { "type": "integer", "minimum": 1, "maximum": 4 },
            "benchmarks_cleared": { "type": "integer", "minimum": 0, "maximum": 7 },
            "exercises_per_session": { "type": "integer", "minimum": 1 },
            "sets_per_exercise": { "type": "integer", "minimum": 1 },
            "weekly_set_capacity": { "type": "integer", "minimum": 0 },
            "weekly_sets_allocated": { "type": "integer", "minimum": 0 },
            "unallocated_sets": { "type": "integer", "minimum": 0 },
            "target_weekly_sets_per_muscle": { "type": "integer", "minimum": 0 },
            "scale_factor": { "type": "number", "minimum": 0 },
            "per_muscle_weekly_sets": {
              "type": "object",
              "required": [
                "chest",
                "back",
                "shoulders",
                "biceps",
                "triceps",
                "quads",
                "hamstrings",
                "glutes",
                "calves",
                "core"
              ],
              "additionalProperties": false,
              "properties": {
                "chest": { "type": "integer", "minimum": 0 },
                "back": { "type": "integer", "minimum": 0 },
                "shoulders": { "type": "integer", "minimum": 0 },
                "biceps": { "type": "integer", "minimum": 0 },
                "triceps": { "type": "integer", "minimum": 0 },
                "quads": { "type": "integer", "minimum": 0 },
                "hamstrings": { "type": "integer", "minimum": 0 },
                "glutes": { "type": "integer", "minimum": 0 },
                "calves": { "type": "integer", "minimum": 0 },
                "core": { "type": "integer", "minimum": 0 }
              }
            },
            "warnings": {
              "type": "array",
              "items": {
                "enum": [
                  "capacity_below_mev",
                  "capacity_exceeds_target",
                  "untrained:chest",
                  "untrained:back",
                  "untrained:shoulders",
                  "untrained:biceps",
                  "untrained:triceps",
                  "untrained:quads",
                  "untrained:hamstrings",
                  "untrained:glutes",
                  "untrained:calves",
                  "untrained:core",
                  "full_body_high_frequency"
                ]
              }
            }
          }
        }
      ]
    }
  }
}
