{
  "$schema_version": "1.0",
  "created_at": "2026-08-12T09:00:00Z",
  "program": {
    "name": "Chest and Arms Season",
    "emoji": "🔥",
    "primary_goal": "both",
    "days_per_week": 4,
    "session_minutes": "40-60",
    "split": "upper_lower",
    "deload": false
  },
  "volume": {
    "model_version": "1.0",
    "age": 33,
    "bodyfat_midpoint": 15,
    "equipment_tier": 3,
    "benchmarks_cleared": 5,
    "exercises_per_session": 6,
    "sets_per_exercise": 3,
    "weekly_set_capacity": 72,
    "weekly_sets_allocated": 72,
    "unallocated_sets": 0,
    "target_weekly_sets_per_muscle": 14,
    "scale_factor": 0.544,
    "per_muscle_weekly_sets": {
      "chest": 8,
      "back": 9,
      "shoulders": 8,
      "biceps": 7,
      "triceps": 7,
      "quads": 8,
      "hamstrings": 7,
      "glutes": 7,
      "calves": 6,
      "core": 5
    },
    "warnings": [
      "capacity_below_mev"
    ]
  }
}
