{
  "$schema_version": "1.0",
  "created_at": "2026-08-12T09:00:00Z",
  "program": {
    "name": "Starting Anyway",
    "emoji": "🐢",
    "primary_goal": "both",
    "days_per_week": 3,
    "session_minutes": "40-60",
    "split": "full_body",
    "deload": false
  },
  "volume": {
    "model_version": "1.0",
    "age": 49,
    "bodyfat_midpoint": 42,
    "equipment_tier": 2,
    "benchmarks_cleared": 0,
    "exercises_per_session": 6,
    "sets_per_exercise": 3,
    "weekly_set_capacity": 54,
    "weekly_sets_allocated": 54,
    "unallocated_sets": 0,
    "target_weekly_sets_per_muscle": 8,
    "scale_factor": 0.809,
    "per_muscle_weekly_sets": {
      "chest": 7,
      "back": 8,
      "shoulders": 6,
      "biceps": 4,
      "triceps": 4,
      "quads": 7,
      "hamstrings": 6,
      "glutes": 6,
      "calves": 3,
      "core": 3
    },
    "warnings": [
      "capacity_below_mev",
      "untrained:chest",
      "untrained:back",
      "untrained:shoulders",
      "untrained:biceps",
      "untrained:triceps"
    ]
  }
}
