{
  "$schema_version": "1.0",
  "created_at": "2026-08-12T09:00:00Z",
  "program": {
    "name": "Back Width Block",
    "emoji": "🦋",
    "primary_goal": "hypertrophy",
    "days_per_week": 6,
    "session_minutes": "90-120",
    "split": "upper_lower",
    "deload": true
  },
  "volume": {
    "model_version": "1.0",
    "age": 29,
    "bodyfat_midpoint": 20.5,
    "equipment_tier": 4,
    "benchmarks_cleared": 7,
    "exercises_per_session": 10,
    "sets_per_exercise": 3,
    "weekly_set_capacity": 180,
    "weekly_sets_allocated": 180,
    "unallocated_sets": 0,
    "target_weekly_sets_per_muscle": 18,
    "scale_factor": 1.039,
    "per_muscle_weekly_sets": {
      "chest": 18,
      "back": 21,
      "shoulders": 20,
      "biceps": 21,
      "triceps": 21,
      "quads": 19,
      "hamstrings": 16,
      "glutes": 16,
      "calves": 15,
      "core": 13
    },
    "warnings": []
  }
}
